investor,section,content
howard_marks,investment_philosophy,"Risk aversion is the essential element that keeps markets safe and sane, as it forces investors to demand generous compensation for bearing risk."
howard_marks,investment_philosophy,"Assembling a portfolio that incorporates risk control is a hidden accomplishment most of the time, since risk only turns into loss occasionally when tested by negative events."
howard_marks,investment_philosophy,Investing is a fascinating and challenging pursuit because there is no single formula that can simultaneously minimize all the different types of risk.
howard_marks,investment_philosophy,"Risk management is a primary determinant of achieving excellent investment returns, and a deep understanding of risk is essential."
howard_marks,investment_philosophy,"The true definition of risk is the uncertainty of an outcome and the possibility of permanent loss, not the academic concept of volatility, which is an inadequate and often irrelevant metric."
howard_marks,investment_philosophy,"The relationship between risk and return is not a simple line; as risk increases, the range of possible outcomes widens, incorporating both higher potential returns and a greater possibility of loss."
howard_marks,investment_philosophy,"Investment risk is primarily the likelihood of a permanent loss of capital or an unacceptably low return, not price volatility."
howard_marks,investment_philosophy,"Risk is subjective and personal, not intrinsic to the investment itself, as different investors have different needs, goals, and constraints."
howard_marks,investment_philosophy,"The market is not an efficient machine that precisely assesses risk and allocates prospective returns proportionately, partly because risk is not easily quantifiable like volatility."
howard_marks,investment_philosophy,"Investors cannot expect to make money without taking risks, but they must demand and receive adequate compensation, in the form of risk premiums, for any incremental risk they bear."
howard_marks,investment_philosophy,"True investment success comes not from being risk-tolerant, but from being appropriately risk-averse, as this is the mindset that leads to demanding proper compensation for risk."
howard_marks,investment_philosophy,"Oaktree's philosophy includes being alert for periods when other investors forget to fear risk, as these are the times when risk premiums disappear from the market."
howard_marks,investment_philosophy,Investors should generally prefer liquid investments and only take on illiquidity if they are being sufficiently rewarded with a return premium for that specific risk.
howard_marks,investment_philosophy,"Oaktree was built on the belief that risk control is 'the most important thing,' as it extends an investment career and increases the likelihood of long-term success."
howard_marks,investment_philosophy,"The investor's job is to strike a proper balance between offense (pursuit of gain) and defense (loss prevention); in risky environments, it's important to pay more attention to loss prevention."
howard_marks,investment_philosophy,"Oaktree's mantra is to 'move forward, but with caution,' with the emphasis on caution increasing when market conditions become more carefree and risky."
howard_marks,investment_philosophy,"The investor's job is to intelligently bear risk for profit, and doing this well is what separates professionals from the rest."
howard_marks,investment_philosophy,"As investors are fundamentally risk-averse, they must be induced to make riskier investments by the offer of higher prospective returns."
howard_marks,investment_philosophy,"Oaktree's philosophy emphasizes risk control, which is distinct from risk avoidance; risk is welcomed at the right time, in the right instances, and at the right price to earn returns above the risk-free rate."
howard_marks,investment_philosophy,"The primary investment philosophy is that risk is not volatility, but rather the fundamental chance of losing money. Investment decisions should be based on whether the potential return adequately compensates for this risk of permanent capital loss."
howard_marks,investment_philosophy,"The ultimate result of an investment, potentially years in the future, is what truly matters, not the volatility of returns along the way. This long-term perspective is central to the investment process."
howard_marks,investment_philosophy,"A qualitative, judgment-based assessment of risk is superior to purely quantitative models. True risk is a concept or a worry that cannot be boiled down to a single, universally applicable number."
howard_marks,investment_philosophy,"Since the future is inherently uncertain, earning high returns requires bearing meaningful risk, such as the possibility of loss in pursuit of absolute gain or underperformance in pursuit of outperformance."
howard_marks,investment_philosophy,"The willingness to live with some losses is an essential ingredient in investment success, as the only way to have no losers is to take no risk, which also results in no return."
howard_marks,investment_philosophy,"Long-term success typically results from making many well-reasoned investments and accepting that some will fail, rather than from a record of consistent, individual successes."
howard_marks,investment_philosophy,"To achieve superior returns, you must sacrifice certainty and bear risk, but this must be done skillfully, intelligently, and with emotion under control."
howard_marks,investment_philosophy,Oaktree was built on the foundational belief that risk control is 'the most important thing' for long-term success.
howard_marks,investment_philosophy,"The goal is risk control, not risk avoidance; while you shouldn't expect to make money just for bearing risk, you also shouldn't expect to make money without bearing risk."
howard_marks,investment_philosophy,"Investors must strike a proper balance between offense and defense, and between worrying about losing money and worrying about missing opportunity. In risky environments, it's more important to pay attention to loss prevention than the pursuit of gain."
howard_marks,investment_philosophy,"Oaktree's mantra is to 'move forward, but with caution,' with the emphasis on caution increasing when market conditions become more risky and imprudent."
howard_marks,investment_philosophy,"The greatest investment risk comes not from companies or securities, but from prices that are too high relative to fundamentals, which occurs mainly because of the actions of market participants."
howard_marks,investment_philosophy,"A core principle is that while we can never know where we're going due to the unreliability of macro forecasting, we must strive to know where we are in terms of market sentiment and behavior."
howard_marks,investment_philosophy,"One of the most important cycles in investing is the pendulum swing between risk aversion and risk tolerance, with risk aversion being the essential element in sane, safe markets."
howard_marks,investment_philosophy,"When other investors are acting imprudently and making the world riskier, our own level of caution should rise; conversely, when others become overly cautious, we should become aggressive."
howard_marks,investment_philosophy,"The primary goal is to achieve market performance or slightly better in good times and highly superior performance in bad times, leading to above-average results over full cycles with less volatility."
howard_marks,investment_philosophy,"The key to superior long-term performance is controlling risk, which involves building a portfolio with downside protection rather than just focusing on finding winners."
howard_marks,investment_philosophy,"Oaktree's approach is designed to provide outperformance in tough times, which helps investors resist selling at cyclical lows and creates a favorable overall experience."
howard_marks,investment_philosophy,"While academic theory suggests markets are efficient, in practice, psychological excesses create periods where markets and securities are mispriced, offering opportunities for active investors."
howard_marks,investment_philosophy,"The goal of superior investing is to achieve asymmetry, which means structuring investments to have more upside potential than downside risk."
howard_marks,investment_philosophy,"True investment skill, or 'alpha,' is the ability to alter an investment's probability distribution to be biased toward positive outcomes, resulting in superior risk-adjusted returns."
howard_marks,investment_philosophy,"The process of taking on investment risk should be done explicitly and intelligently, rather than as an afterthought."
howard_marks,investment_philosophy,Exposure to risk is a necessary component for an investment plan to meet its long-term objectives.
howard_marks,investment_philosophy,"Investors face two primary risks: the risk of losing money and the risk of missing opportunities. It is possible to eliminate one of these risks, but not both."
howard_marks,investment_philosophy,"While the market must be structured to make it appear that higher risk leads to higher returns, this cannot always be the case, otherwise the investments would not truly be risky."
howard_marks,investment_philosophy,"Superior investing has two primary elements: seeing a quality that others don't see or appreciate that isn't reflected in the price, and then having it turn out to be true."
howard_marks,investment_philosophy,"The process of superior investing must begin with investors who are unusually perceptive, unconventional, and iconoclastic, which is why successful investors are said to spend a lot of their time being lonely."
howard_marks,investment_philosophy,Significant returns are not made by buying what everyone likes; they are made by buying what everyone underestimates.
howard_marks,investment_philosophy,"Risk aversion is the essential element that keeps markets safe and sane, as it forces investors to demand generous risk premiums to compensate them for bearing risk."
howard_marks,investment_philosophy,"There is such a thing as 'upside risk,' which is the risk of being underexposed to positive developments like a stronger-than-expected economy or market appreciation."
howard_marks,investment_philosophy,"At Oaktree, risk control is the paramount principle, considered the ""only thing"" that matters."
howard_marks,investment_philosophy,"The core of investing is the ""intelligent bearing of risk for profit,"" which is distinct from risk avoidance that often leads to return avoidance."
howard_marks,investment_philosophy,"Investing consists of bearing uncertainty in the pursuit of attractive returns, so risk avoidance is only appropriate for those who cannot survive tough times."
howard_marks,investment_philosophy,"Markets are not efficient in the academic sense of always being 'right'; while they may reflect consensus opinion, that opinion can be far from correct, allowing for gains from skillful active management."
howard_marks,investment_philosophy,The most important decision in portfolio management is combining ownership assets and debt assets to position the portfolio at the risk/return level that is right for the investor.
howard_marks,investment_philosophy,"Alpha, or 'gains resulting from superior individual skill,' is achievable because market inefficiencies mean some assets, markets, or strategies can offer a better risk/return bargain than others."
howard_marks,investment_philosophy,"In contrast to the academic view, active decision-making is valuable as some managers can operate within a market or strategy to produce superior risk-adjusted returns."
howard_marks,investment_philosophy,"The intelligent acceptance of recognized risk for profit underlies some of the wisest, most profitable investments, even if most investors dismiss them as dangerous speculations."
howard_marks,investment_philosophy,"A core principle is to be risk-averse, meaning that for a given prospective return, the safer investment is always preferred over the riskier one."
howard_marks,invariable_truths,"As an asset appreciates and sentiment towards it improves, it paradoxically becomes riskier, all else being equal."
howard_marks,invariable_truths,"Risk is low when risk aversion and risk consciousness are high, and risk is high when they are low."
howard_marks,invariable_truths,"Paradoxically, risk is lowest when risk aversion and risk consciousness are high, and risk is highest when they are low."
howard_marks,invariable_truths,Risk is often hidden and deceptive; the true riskiness of an investment only becomes apparent when it is tested by negative events.
howard_marks,invariable_truths,"Risk is multi-faceted, and efforts to reduce one type of risk, like the risk of losing money, invariably increase another, like the risk of missing opportunities."
howard_marks,invariable_truths,"In times of crisis, diversification can fail as correlations between seemingly unrelated assets go to one and everything collapses in unison."
howard_marks,invariable_truths,"Riskier investments must offer the prospect of higher returns to attract capital from risk-averse investors, but there is no guarantee these higher prospective returns will ever materialize."
howard_marks,invariable_truths,"If riskier investments reliably produced higher returns, they wouldn't actually be riskier; the uncertainty of the outcome and the possibility of loss are inherent parts of the definition of risk."
howard_marks,invariable_truths,"The future will not necessarily be like the past, and no value is ever added through simple extrapolation of historical data."
howard_marks,invariable_truths,"Since no single investment approach works all the time, even the best and most disciplined investors can have significant periods of underperformance."
howard_marks,invariable_truths,"In bubble periods, underperformance can be a badge of courage, signifying a refusal to participate in speculative manias."
howard_marks,invariable_truths,"If a risk-free path to high returns existed, everyone would pursue it, which would bid up the price, lower the return, and ultimately introduce risk."
howard_marks,invariable_truths,"If risky investments always produced high returns, they would not, by definition, be risky."
howard_marks,invariable_truths,"When investors are unworried and risk-tolerant, they will accept risk without being compensated for it, causing risk premiums to disappear from the market."
howard_marks,invariable_truths,"The widespread belief that there is no risk is one of the riskiest of all market conditions, as it means assets are not priced to include a margin of safety."
howard_marks,invariable_truths,"An illiquidity premium only exists when investors collectively prefer liquidity; when illiquidity becomes popular, the premium for holding it diminishes or vanishes."
howard_marks,invariable_truths,"During a crisis, correlations often go to one, causing assets that are supposed to be diversified to collapse in unison."
howard_marks,invariable_truths,"While you shouldn’t expect to make money just for bearing risk, you also shouldn’t expect to make money without bearing risk."
howard_marks,invariable_truths,"When undemanding capital markets and a low level of risk aversion combine to encourage investors to engage in risky practices, something usually goes wrong eventually."
howard_marks,invariable_truths,"The intelligent acceptance of recognized risk for profit underlies some of the wisest and most profitable investments, even if most investors dismiss them as dangerous."
howard_marks,invariable_truths,"Risky assets can make for good investments, provided they are purchased at a cheap enough price."
howard_marks,invariable_truths,"The widely accepted academic and practical assumption that 'volatility equals risk' is fundamentally incorrect. Its appeal lies in its quantifiability, not its accuracy in representing the true danger to an investment."
howard_marks,invariable_truths,"The real risk of an investment is not an absolute, quantifiable number; it varies by asset class, by investor, and by situation. For example, quarterly volatility is not a meaningful risk for an endowment with an infinite time horizon."
howard_marks,invariable_truths,"The saying 'No risk, no reward' is largely true, as market efficiency usually prevents the possibility of earning big gains with little risk."
howard_marks,invariable_truths,"The paradox of risk-taking is inescapable: you must take risks to be successful in competitive arenas, but taking risk does not guarantee success."
howard_marks,invariable_truths,"You should not expect to make money without bearing risk, but you also should not expect to make money simply for taking risk."
howard_marks,invariable_truths,"Since the future is unpredictable, risk control must be applied constantly, not just when the future seems ominous."
howard_marks,invariable_truths,"When undemanding capital markets and a low level of risk aversion encourage investors to engage in risky practices, something usually goes wrong eventually."
howard_marks,invariable_truths,"Investing is not supposed to be easy, and this is profoundly applicable to risk management; anyone who finds it easy is likely overlooking something."
howard_marks,invariable_truths,"Risk is cyclical and will inevitably reach extreme levels someday, at which point great caution will be required."
howard_marks,invariable_truths,"The usual pattern is that those who participate in a 'race to the bottom' by reducing prudence are eventually punished, while the naysayers' performance exceeds theirs in the long run."
howard_marks,invariable_truths,"Investment risk is not the same as volatility and cannot be easily observed or quantified, especially during good years when it remains invisible."
howard_marks,invariable_truths,"In inefficient markets, risk and return are not always proportional, which creates the opportunity to achieve superior risk-adjusted returns."
howard_marks,invariable_truths,"True investment risk is not measurable, even after the fact, which makes assessing who has done the best job of risk management extremely difficult."
howard_marks,invariable_truths,"Riskier investments introduce the potential for higher returns, but they also introduce the possibility of significant losses and other undesirable side effects."
howard_marks,invariable_truths,"In practice, markets are not always efficient because investor psychology, such as panic or euphoria, violates the theoretical assumption of rational and objective participants."
howard_marks,invariable_truths,Taking on risk that entails potential consequences you might not be able to financially survive is one of the most foolish things an investor can do.
howard_marks,invariable_truths,"Risky investments cannot always work out, or else they wouldn't be risky, and when risk bearing fails, the consequences are severe and remind people what risk is all about."
howard_marks,invariable_truths,"While taking too little risk can lead to underperformance, it is far better than the consequences of taking too much risk at the wrong time."
howard_marks,invariable_truths,"No one has ever gone bankrupt from an excess of risk consciousness, but a shortage of it has been responsible for major financial crises."
howard_marks,invariable_truths,"Painful bubbles can't form without an underlying grain of truth, but in each case, the merits become too obvious, the ideas too popular, and asset prices dangerously high."
howard_marks,invariable_truths,"There is no asset so good that it can’t become overpriced and thus risky, and few so bad that there’s no price at which they’re a buy and safe."
howard_marks,invariable_truths,"Following popular trends is not a formula for investment success, as popularity is likely to lead investors on a path that is comfortable but pointed in the wrong direction."
howard_marks,invariable_truths,"Risk is counterintuitive; the riskiest thing is the widespread belief that there's no risk, and fear in the market can actually make it safer."
howard_marks,invariable_truths,"As an asset declines in price, it becomes less risky, all else being equal, because the price has fallen. Conversely, as an asset appreciates and sentiment improves, it becomes riskier."
howard_marks,invariable_truths,"For fixed income, the relationship between interest rates and bond prices is absolute: higher interest rates mean lower bond prices."
howard_marks,invariable_truths,"When investors forget to be risk-conscious and fail to demand adequate compensation for risk, they will make risky investments even with skimpy premiums, leading to eventual penalties rather than rewards."
howard_marks,invariable_truths,"Because investing entails risk, results will be unpredictable and inconsistent, meaning very few investors can have only good years."
howard_marks,invariable_truths,"You can avoid risk by buying Treasury bills, but you shouldn't expect to be well paid for an investment where you're sure to get your money back."
howard_marks,invariable_truths,"The two fundamental asset classes are ownership and debt, and they possess enormously different characteristics."
howard_marks,invariable_truths,"As expected return increases, the accompanying risk also increases, which encompasses both the uncertainty of the outcome and the likelihood of a bad one; there is no free lunch."
howard_marks,invariable_truths,"Few investment assets, strategies, or tools are inherently risky or safe; their riskiness depends on the context and price paid."
howard_marks,invariable_truths,"In times of panic, seemingly unconnected investments can become similarly affected, as all correlations tend to go to one."
howard_marks,invariable_truths,"Investing is never easy because there is no single right answer or number to guide decisions, but this complexity is what makes it interesting."
howard_marks,buy_criteria,"Favorable investment opportunities arise when high risk aversion prevails, leading investors to perform extensive due diligence, make conservative assumptions, and deny capital to risky ventures."
howard_marks,buy_criteria,Opportunities can be found in unorthodox investments because many institutional investors avoid them due to the risk of being unconventional.
howard_marks,buy_criteria,"Investors should demand higher prospective returns for investments where the fundamental risk of losing money is higher, rather than focusing on price volatility."
howard_marks,buy_criteria,"Before committing to illiquid investments, investors must ensure they are being adequately compensated with a sufficient return premium for bearing that specific risk."
howard_marks,buy_criteria,"Investments should be made when prospective returns incorporate appropriate risk premiums, which is most likely to be the case when the majority of investors are suitably risk-averse."
howard_marks,buy_criteria,We invest only when we are convinced the likely return far more than compensates for the risk involved.
howard_marks,buy_criteria,"When considering adding an asset to a portfolio, the key questions are whether the risk of losing the client's money is tolerable and if it is sufficiently offset by the likely return."
howard_marks,buy_criteria,"The specific risks to analyze are tailored to the asset class, such as focusing on default risk in high yield bonds or the risk of a reorganization going against you in distressed debt."
howard_marks,buy_criteria,A risky investment should be made when you decide that sufficient conditions have been met and the reasons for taking the chance are sound.
howard_marks,buy_criteria,Only invest when there is a commensurate risk premium for the degree of risk being undertaken.
howard_marks,buy_criteria,"When other market participants become overly cautious and run from risk, assets can become so cheap that it is time to turn aggressive."
howard_marks,buy_criteria,"The best opportunities often arise during periods of excessive risk aversion, when the market offers disproportionately generous compensation for taking on risk."
howard_marks,buy_criteria,"Investments should be evaluated based on their potential for asymmetry, seeking situations that offer more upside potential than downside risk."
howard_marks,buy_criteria,"Credit investments are attractive when their absolute returns are significant, competitive with historical equity returns, and supported by contractual promises to pay interest and return principal."
howard_marks,buy_criteria,"The best buying opportunities are usually found in things most people don’t understand or believe in, particularly securities that are widely considered 'too risky'."
howard_marks,buy_criteria,"Focus on the relationship between an asset's price and its intrinsic value, as low-quality assets can be safe and high-quality assets can be risky depending on the price paid."
howard_marks,buy_criteria,"Look for opportunities where a broad negative consensus has driven all optimism out of an asset's price, as this can make it the least risky thing to own."
howard_marks,buy_criteria,"A risk is acceptable to take on if it is one you are aware of, can analyze, can diversify, and are well-paid to assume."
howard_marks,buy_criteria,"Wise and profitable investments can be made by intelligently accepting risks that are widely recognized by the market, as these assets may be mispriced due to being dismissed as too dangerous."
howard_marks,avoid_red_flags,"Avoid markets where investors are not risk-conscious and fail to demand adequate compensation for risk, as this leads to overpriced risky assets."
howard_marks,avoid_red_flags,"Be wary when widespread risk tolerance causes due diligence and skepticism to fall by the wayside, as this environment sets the stage for future losses."
howard_marks,avoid_red_flags,"Recognize that after several years of a benign environment, a risky investment can easily be mistaken for a safe one."
