investor,section,content
howard_marks,avoid_red_flags,Avoid the simplistic and dangerous belief that taking more risk will automatically lead to making more money.
howard_marks,avoid_red_flags,"Avoid unthinking adherence to the latest market trends, which often dominates market movements to the detriment of thoughtful investors."
howard_marks,avoid_red_flags,"Avoid equating risk with volatility, as it is a flawed and insufficient measure that can be misleading."
howard_marks,avoid_red_flags,"Avoid relying on historical volatility as the sole indicator of an asset's future risk, as the future is not a mere extrapolation of the past."
howard_marks,avoid_red_flags,"Avoid investing when a widespread belief that there is no risk prevails, as this indicates that risk premiums have likely been competed away."
howard_marks,avoid_red_flags,"Be highly cautious when investors are unworried and risk-tolerant, leading them to buy assets at high valuation multiples and accept narrow credit spreads."
howard_marks,avoid_red_flags,A market environment characterized by too much money chasing too few deals and a general lack of risk aversion is a signal of high risk and low prospective returns.
howard_marks,avoid_red_flags,"Avoid investing when low interest rates have caused money to flood into riskier assets, leading to a deterioration in capital market standards and a lack of caution from other investors."
howard_marks,avoid_red_flags,"Be wary when it becomes easy for issuers to place risky securities, as this indicates it is hard for investors to buy safe ones."
howard_marks,avoid_red_flags,Recognize that a market is risky when there is a low degree of risk aversion and investors are being encouraged to engage in risky practices for which there is no commensurate risk premium.
howard_marks,avoid_red_flags,"Avoid relying on volatility or standard deviation as the primary measure of risk, as these quantifiable metrics fail to capture the actual potential for permanent capital loss."
howard_marks,avoid_red_flags,"Avoid constructing a portfolio where the underlying assets are highly correlated, as this negates the protective benefits of diversification against catastrophic error."
howard_marks,avoid_red_flags,Avoid aggressive tactics when you observe other investors dropping their usual caution and capital market standards deteriorating.
howard_marks,avoid_red_flags,"When others conduct their affairs with less prudence, it is a signal to conduct your own affairs with greater prudence."
howard_marks,avoid_red_flags,"Be wary when investors drop their risk aversion and become risk-tolerant, as this creates a dangerous environment of higher asset prices, lower prospective returns, and elevated risk."
howard_marks,avoid_red_flags,"A rise in general risk tolerance becomes highly worrisome when it is accompanied by extended valuations, as this combination often precedes a market downturn."
howard_marks,avoid_red_flags,"A 'race to the bottom' signifies a widespread reduction in prudence from investors and capital providers, leading to deteriorating new issue quality and insufficient premiums for bearing risk."
howard_marks,avoid_red_flags,"Avoid being overly aggressive when risk-bearing is eagerly embraced by the market, as the safer part of the risk spectrum can offer a superior proposition during such times."
howard_marks,avoid_red_flags,"A major red flag is an investor who believes they have skill ('alpha') but cannot demonstrate an ability to produce superior risk-adjusted returns, as most investors incorrectly believe they possess this skill."
howard_marks,avoid_red_flags,"Avoid having a high willingness to take on risk when your financial ability to bear that risk is low, a posture described as 'naive' and foolish."
howard_marks,avoid_red_flags,"Resist the temptation to chase a market that has already experienced a long boom, as the risk of participating in a subsequent bust can be far greater than the risk of missing further gains."
howard_marks,avoid_red_flags,"Avoid being driven by FOMO (Fear Of Missing Out), as it can lead to making investments one shouldn't and doesn't understand, simply because others are doing them."
howard_marks,avoid_red_flags,"A shortage of risk consciousness is a major red flag, as it leads to the kind of imprudent investments that caused the 2007 crisis."
howard_marks,avoid_red_flags,"Avoid assets that have become too popular and whose merits are too obvious, as this is a sign that prices have likely become dangerously high."
howard_marks,avoid_red_flags,"Be wary when there is a widespread belief that there's no risk in an asset or a market, as this is the most dangerous condition of all."
howard_marks,avoid_red_flags,"Do not follow popular trends or 'accepted wisdom,' as these comfortable paths often lead to poor investment outcomes."
howard_marks,avoid_red_flags,"Be wary of markets where investors are not risk-conscious and fail to require adequate compensation for bearing risk, as this leads to risky investments being made for skimpy prospective returns."
howard_marks,avoid_red_flags,Decline to take risks that either exceed the quantum of risk you want to live with or for which you wouldn’t be well rewarded for bearing.
howard_marks,avoid_red_flags,"Avoid the simplistic and linear belief that 'more risk, more return' is a certainty, as it ignores the true nature of risk which includes a wider range of outcomes and worse potential losses."
howard_marks,avoid_red_flags,"Avoid over-reliance on outside 'experts' or quantitative models like Value at Risk (VAR) to assess investment risk, as they are of limited utility for the extreme events that truly matter."
howard_marks,avoid_red_flags,"Avoid buying securities that are 'all the rage' and highly esteemed, as this often involves bearing significant risk unknowingly."
howard_marks,position_sizing_portfolio,Holding only one type of 'safe' asset can create an under-diversified portfolio that is vulnerable to a single shock.
howard_marks,position_sizing_portfolio,Adding a few 'risky' assets to a portfolio of safe assets can actually make the overall portfolio safer by increasing its diversification.
howard_marks,position_sizing_portfolio,"As a matter of basic prudence, investors should always limit the proportion of their portfolio that is committed to illiquid investments."
howard_marks,position_sizing_portfolio,"Portfolios are diversified appropriately to ensure they are not exposed to freak occurrences and widespread losses, similar to how an insurer diversifies its policyholders."
howard_marks,position_sizing_portfolio,"The main reason to hold more than one asset is for diversification to protect against catastrophic error, but this is only effective if the assets are not highly correlated."
howard_marks,position_sizing_portfolio,"Adding an uncorrelated, high-risk asset can actually reduce the overall riskiness of a portfolio. This understanding allows for the inclusion of high-return, high-risk assets in a risk-averse manner."
howard_marks,position_sizing_portfolio,Ultimate success is a function of the ratio of winners to losers and the magnitude of the gains relative to the losses.
howard_marks,position_sizing_portfolio,"A successful portfolio model consists of many decent investments, a few heavily-weighted big winners held for the long term, and relatively few big losers."
howard_marks,position_sizing_portfolio,"Investors must accept that success stems from making a large number of investments with the expectation they will succeed, while knowing that a portion of them will not."
howard_marks,position_sizing_portfolio,"Oaktree's portfolio posture is calibrated to the market environment; a 'middling stance' of 'move forward, but with caution' is appropriate when the outlook isn't terrible but assets aren't cheap."
howard_marks,position_sizing_portfolio,"Maximum caution is reserved for periods when risk reaches extreme levels, while aggressiveness is warranted only when assets are very cheap due to widespread fear."
howard_marks,position_sizing_portfolio,An investor's overall risk posture and portfolio construction should be determined by explicitly considering both their financial ability to bear risk and their psychological willingness to do so.
howard_marks,position_sizing_portfolio,"An investor with a high ability to bear risk but low willingness is considered 'defensive' and will operate at a lower risk level than their capacity allows, constraining returns but also the range of outcomes."
howard_marks,position_sizing_portfolio,Adding a few 'risky' assets to a portfolio of 'safe' assets can actually make the overall portfolio safer by increasing its diversification.
howard_marks,position_sizing_portfolio,The primary decision in portfolio construction is to combine ownership and debt assets to achieve the specific position on the risk/return continuum that is appropriate for you.
howard_marks,position_sizing_portfolio,"Intelligent diversification involves investing in assets that respond differently to the same factors, creating 'offsets' where a negative influence on one investment might be a positive for another."
howard_marks,position_sizing_portfolio,"Portfolio construction must account for 'fault lines' and the potential for 'domino effects,' where trouble in one investment can cascade and impact others in unanticipated ways."
howard_marks,sell_discipline,"The decision to sell or reduce exposure depends on the degree of risk and valuation; a rise in risk tolerance is a signal to pay attention, but not necessarily to sell unless it has reached a clear danger zone."
howard_marks,sell_discipline,"Even if riskier behavior is observed, it may not be time to bail out of markets if valuations are not highly extended and the absolute quantum of risk is not as high as in past bubbles."
howard_marks,sell_discipline,A core objective is to cultivate enough resolve to resist selling assets at cyclical lows during market downturns.
howard_marks,risk_management,Risk is often hidden and deceptive; its true nature is only revealed when an investment is tested by a negative environment.
howard_marks,risk_management,"The task of managing risk should not be left to designated risk managers, as outsiders to the fundamental investment process lack the deep asset knowledge required for appropriate decisions."
howard_marks,risk_management,"Efforts to reduce the risk of losing money invariably increase the risk of missing opportunities, and buying higher-quality assets to reduce fundamental risk often increases valuation risk."
howard_marks,risk_management,"An investment susceptible to an infrequent but serious negative development can appear safer than it really is, especially after a long period of a benign environment."
howard_marks,risk_management,"A portfolio with proper risk control is a hidden accomplishment, as its value is only apparent during downturns when risk materializes into loss."
howard_marks,risk_management,"Risk management should not be outsourced to designated specialists using statistical models, as they lack the deep, fundamental knowledge of the underlying assets."
howard_marks,risk_management,"At Oaktree, while tools like VaR and Sharpe ratios are used, they are not overly relied upon; risk management is the responsibility of every investment professional, applying judgment and experience."
howard_marks,risk_management,"The primary risk investors should care about is the possibility of loss, not price volatility. Oaktree does not avoid investments simply because their prices might fluctuate or they might have a down quarter."
howard_marks,risk_management,"Riskier investments are characterized by a wider distribution of potential outcomes, meaning they have both higher expected returns and a greater possibility of low returns or losses."
howard_marks,risk_management,"Rejecting volatility as a proxy for risk is a core tenet, as it was chosen by academics for convenience and fails to capture what practitioners consider true investment risk."
howard_marks,risk_management,"The primary risk to manage is the probability of permanent capital loss, not the volatility of an asset's price."
howard_marks,risk_management,"Volatility is a poor proxy for risk; for example, a stock is not necessarily riskier at $50 after falling from $80 than it was at the higher price."
howard_marks,risk_management,"True value is added by predicting changes in an asset's riskiness, rather than just extrapolating its historical volatility."
howard_marks,risk_management,"One must be aware of subjective risks like career risk and the pressure for conventionality, which can lead to herd behavior and prevent superior results."
howard_marks,risk_management,"During market manias, a key risk management decision is to willingly accept the risk of underperformance by refusing to participate in the bubble."
howard_marks,risk_management,"Risk is a constant that every investor must continually think about, and it is impossible to earn substantial returns without taking it."
howard_marks,risk_management,Illiquidity should be treated as just another form of risk that requires compensation and must be prudently limited within a portfolio.
howard_marks,risk_management,"Investors should be skeptical of complex and innovative financial products, especially those introduced in bull markets, as their true risks are only revealed in downturns."
howard_marks,risk_management,"Certain risks should not be taken regardless of the potential return offered, and investors should be skeptical of assumed outcomes and limit the risks they bear."
howard_marks,risk_management,"Risk management should be the responsibility of every participant in the investment process, applying experience, judgment, and knowledge of the underlying investments rather than just relying on models."
howard_marks,risk_management,"Do not put too much faith in risk metrics like VaR and Sharpe ratios; while Oaktree uses them as tools, they can understate risk, especially in a crisis."
howard_marks,risk_management,"Risk control must be applied constantly, not just when the future seems ominous; it is like fire insurance that is valuable even in years without a fire."
howard_marks,risk_management,"Effective risk control requires humility, a lack of hubris, and knowing what you don’t know, as overconfidence is a major trap."
howard_marks,risk_management,"The goal is indispensable risk control, not risk avoidance, because avoiding all risk usually means avoiding returns as well."
howard_marks,risk_management,"The less prudence with which others conduct their affairs, the greater the prudence with which we should conduct our own."
howard_marks,risk_management,"Risk management is about 'risk intelligence,' not risk aversion; it requires that risks are understood, appropriately managed, and made transparent."
howard_marks,risk_management,"Oaktree's process for bearing risk involves four key elements: ensuring the risk is known, that it can be analyzed, that it can be diversified, and that the compensation for bearing it is high."
howard_marks,risk_management,"The first tenet in Oaktree’s investment philosophy is the importance of risk control, which is about intelligently managing risk rather than avoiding it altogether."
howard_marks,risk_management,"At Oaktree, risk management is defined as managing the chance of losing clients' money, not managing the volatility of returns."
howard_marks,risk_management,"Risk is viewed as a concept or a worry, not a number, and is not subject to precise quantification or numerical manipulation. This qualitative approach is considered the right way to think about risk."
howard_marks,risk_management,"Because Oaktree's capital is in locked-up funds or long-term relationships, the firm can ignore short-term volatility and focus exclusively on the ultimate positive or negative outcome of an investment."
howard_marks,risk_management,"Understanding and managing correlation is a critical element of risk management, as the behavior of assets in combination determines a portfolio's overall risk profile."
howard_marks,risk_management,"The risk of taking too little risk is very real, as it can lead to insufficient returns to meet financial goals or underperformance relative to benchmarks."
howard_marks,risk_management,"Risk is as much intuited as it is calculated, and it is up to the investor to decide if the conditions are right to take a chance on a risky move."
howard_marks,risk_management,"A key part of the investment process is accepting that some investments will result in losses, as risk avoidance is likely to result in return avoidance."
howard_marks,risk_management,"Risk management should be the responsibility of every participant in the investment process, applying experience, judgment, and knowledge of the underlying investments."
howard_marks,risk_management,"While Oaktree uses risk metrics like VaR and Sharpe ratios, one should not put too much faith in them as they are merely tools and cannot capture all aspects of risk."
howard_marks,risk_management,"Effective risk control requires humility, a lack of hubris, and knowing what you don’t know, as overconfidence is one of the greatest traps in investing."
howard_marks,risk_management,Being highly risk-conscious and even 'investing scared' is a valid approach that can extend an investment career and increase the likelihood of long-term success.
howard_marks,risk_management,"Risk control is like fire insurance; it is necessary to have even in years when losses do not occur, because you can't predict when they will."
howard_marks,risk_management,"The primary task in risk management is to assess the market's temperature: determining if investors are risk-averse or risk-tolerant, and thus whether the market is a safe or risky place."
howard_marks,risk_management,"The greatest investment risk stems from paying prices that are too high, and this risk is created by the collective actions of market participants."
howard_marks,risk_management,"When investors are sufficiently risk averse, they demand healthy compensation for accepting incremental risk, which makes the market a relatively safe place."
howard_marks,risk_management,The goal of risk management is to control downside risk sufficiently so that upside potential can be pursued without commensurate exposure to losses.
howard_marks,risk_management,"A superior form of risk management is achieving the same return as a benchmark while taking less risk, which is considered a greater accomplishment than achieving a higher return for the same risk."
howard_marks,risk_management,"To properly judge performance, one must assess both the return achieved and the amount of risk that was borne, not just the headline return figure."
howard_marks,risk_management,The ability to control risk is the key to achieving superior returns in bad times without stripping a portfolio of its potential to make money in good times.
howard_marks,risk_management,Effective risk management involves understanding that market psychology creates cycles; one should be prepared to take more risk when others are fearful and less when they are greedy.
howard_marks,risk_management,A primary goal of risk management is to apply skill ('alpha') to access a market's upside potential without taking on all of its commensurate downside risk.
howard_marks,risk_management,"A defensive risk management approach focuses on avoiding losers to produce good returns with minimal risk, which is one of two primary paths to outperformance."
howard_marks,risk_management,A useful risk framework involves a matrix that plots an investor's financial ability to bear risk against their psychological willingness to bear risk.
howard_marks,risk_management,"The four resulting risk postures are: 'capitalizing' (high ability/high willingness), 'defensive' (high ability/low willingness), 'protective' (low ability/low willingness), and 'naive' (low ability/high willingness)."
howard_marks,risk_management,"Understanding an investor's emotional response to risk, such as whether they would feel worse about a large loss or a missed gain, is a key part of the risk management process."
howard_marks,risk_management,"The main risk in investing is the possibility of permanent loss, but other significant risks include falling short of return requirements and missing opportunities (opportunity cost)."
howard_marks,risk_management,"A key challenge is balancing the two major risks: the risk of losing money and the risk of missing opportunities, as leaning too far to avoid one can make you a victim of the other."
howard_marks,risk_management,"In a low-return environment, investors face a conundrum where safe investments may be inadequate, but seeking higher returns through incremental risk could lead to even lower returns or permanent capital loss."
howard_marks,risk_management,"Investment risk resides most where it is least perceived, and vice versa; a perception of safety often brings on risk, while a perception of risk can lead to safety."
howard_marks,risk_management,"It is critical to distinguish between fundamental risk (the outlook for a business or asset) and investment risk, which is determined by the price paid relative to intrinsic value."
howard_marks,risk_management,"The riskiest thing in the world is the widespread belief that there’s no risk, as this belief abets the careless behavior that brings on financial crises."
howard_marks,risk_management,"A second-level thinker understands the 'perversity of risk': that a perception of safety brings on risk, and a perception of risk can lead to safety."
howard_marks,risk_management,"Estimating an asset's correlation with all other assets in a portfolio is many times harder than estimating its standalone risk, yet it is critical for understanding its impact on the portfolio."
howard_marks,risk_management,Holding only one type of 'safe' asset can make a portfolio under-diversified and vulnerable to a single shock.
howard_marks,risk_management,"Investors in securities, especially long-term bonds, are exposed to purchasing power risk; if inflation rises, future proceeds will buy less, leading investors to demand higher rates and thus causing lower prices."
howard_marks,risk_management,"Fixed income investors are directly exposed to interest rate risk, where higher rates cause lower bond prices."
howard_marks,risk_management,"Risk control is the number one priority at Oaktree, focusing on what could be lost if things get bad rather than just on potential gains."
howard_marks,risk_management,The key questions for risk control are: 'What will happen if events don’t go as planned? How much could I lose if things get bad? And how bad would things have to get?'
howard_marks,risk_management,"Intelligent risk-bearing is possible when the risk is understood, analyzable, diversifiable, and offers adequate compensation for being assumed."
howard_marks,risk_management,"True risk is not just a single number but a distribution of potential outcomes; as risk increases, the range of possible results widens and the potential for severe negative outcomes grows."
howard_marks,risk_management,"A proper visualization of risk shows that as 'risk' increases, not only does the expected return rise, but the range of possible outcomes becomes wider and the bad outcomes become worse."
howard_marks,risk_management,"Understanding the real implications of increased risk—a wider range of outcomes and a longer left-hand tail of undesirable results—should inform an investor's risk posture, potentially leading them to a more moderate position."
howard_marks,risk_management,"Risk assessment is a multi-dimensional, subjective process that cannot be reduced to a single number; it must account for scenarios, offsets, correlations, and domino effects."
howard_marks,risk_management,"Effective risk management is best performed by skilled and experienced investment professionals making subjective judgments, who must remain constantly aware of how much they don't know."
howard_marks,risk_management,"Quantitative models are poor at measuring investment risk at the extremes, but everything important in financial history happens at these extremes, outside of 'normal circumstances'."
howard_marks,risk_management,"The investment professionals directly involved in an investment are best equipped to assess its risks, not separate 'risk measurement officers' or outside experts."
howard_marks,signature_patterns,"When risk tolerance is widespread, investors fail to demand adequate compensation for risk, leading to risky deals being done that set the scene for subsequent losses."
howard_marks,signature_patterns,"After several years of a benign environment, a risky investment can easily pass for a safe one, as its susceptibility to loss has not been tested."
howard_marks,signature_patterns,"A signature communication style involves dedicating entire memos to dissecting a single fundamental investment concept, such as 'Risk', for Oaktree clients."
howard_marks,signature_patterns,"Marks uses custom-drawn graphs, like his modified capital market line, to better illustrate the true nature of investment concepts like the relationship between risk, expected return, and uncertainty."
howard_marks,signature_patterns,A core tenet is the rejection of the academic definition of risk as volatility in favor of a more practical definition centered on the potential for permanent capital loss.
howard_marks,signature_patterns,"The belief that unconventionality creates opportunity, as the fear of being different prevents many investors from pursuing superior results, leaving unorthodox investments mispriced."
howard_marks,signature_patterns,"In bull markets, after a period of strong performance, investors tend to forget the nature of risk and start believing that taking more risk is a reliable path to higher returns."
