investor,section,content
peter_lynch,notable_quotes,"Recently, Forbes published its hit parade of the richest people in the world, and I was reminded that there's never been a market timer on the list."
peter_lynch,notable_quotes,"As soon as you realize you can afford to wait out any correction, the calamity also becomes an opportunity to pick up bargains."
peter_lynch,notable_quotes,"Here is another example of why investors should focus on whether the story is still valid. A stock can fall in half, only to rebound so you end up making several times your money."
peter_lynch,notable_quotes,A company that can manage to grow at 20 percent a year will double its earnings every three and a half years... That's how you make big money.
peter_lynch,notable_quotes,"On my watch at the helm of the Magellan Fund, I often consulted a chart book to check the bearings of companies in the portfolio."
peter_lynch,notable_quotes,"E is the reality of a company's performance, while P is led around by Wall Street expectations."
peter_lynch,notable_quotes,"If Philip Morris maintains its earnings growth, investors will make money no matter what Wall Street thinks."
peter_lynch,notable_quotes,"I'm not a technical analyst, or a wiggle reader who makes predictions on the direction of the next wiggle. I use charts to help me find value among growth companies I follow."
peter_lynch,notable_quotes,"I'd be the last person to suggest using these charts to sell your growth companies every time they looked way overpriced. Instead of investing for the long term, you become a market timer."
peter_lynch,notable_quotes,"Peter Lynch writes Investor's Edge with John Rothchild, and is vice- chairman of Fidelity Management and Research."
peter_lynch,notable_quotes,I've never met an organization that failed to match a challenge grant.
peter_lynch,notable_quotes,"Stocks are a safe bet, but only if you stay invested long enough to ride out the corrections."
peter_lynch,notable_quotes,Remember what makes them a safe bet: corporate earnings.
peter_lynch,notable_quotes,"All things considered, I prefer stocks."
peter_lynch,notable_quotes,"Fast-growing young companies, such as technology firms, don't generally pay dividends, which for them is a plus: They can invest in their own expansion instead of handing the money to shareholders."
peter_lynch,notable_quotes,"Fannie Mae, the leader in the home-mortgage business, tops the list of my favorite companies of all time."
peter_lynch,notable_quotes,"The notion of the story is an important one. As I've said so many times before, if you don't know the story, you don't know the company."
peter_lynch,notable_quotes,"These pros share my insistence, I think, on what I call earnings visibility, which is a way of saying we like to see those earnings coming."
peter_lynch,notable_quotes,It follows that these companies may have been overlooked-which is music to a stock picker's ears.
peter_lynch,notable_quotes,"At the current prices for these stocks, the market is failing to take into account the real future growth of the companies. That's the essence of a good value and a good opportunity."
peter_lynch,notable_quotes,"At Magellan, I loaded up on cyclical stocks during the 1981-1982 economic slump. This strategy was one of the keys to Magellan's success."
peter_lynch,notable_quotes,"The best time to get involved with cyclicals is when the economy is at its weakest, earnings are at their lowest, and public sentiment is at its bleakest."
peter_lynch,notable_quotes,"When the earnings line has a steady upward slope, the way Merck's does, you're dealing with a growth stock. When it wobbles up and down, as Alcoa's does, you're probably dealing with a cyclical."
peter_lynch,notable_quotes,"My sons and I would go over there on Saturday night and count cars. The parking lot was always packed. I thought to myself, 'This is going to be incredible.'"
peter_lynch,notable_quotes,"I was running Fidelity's Magellan fund at the time and was impressed with his explanation. He said that even if the company changed accounting methods, the result would be a one-time earnings drop of 10 to 15 cents. This was peanuts compared to the tremendous growth of the company."
peter_lynch,notable_quotes,It is a tremendous advantage for investors to have stores owned by immature public companies open in their neighborhoods. They get an early whiff of success or failure before Wall Street picks up the trail.
peter_lynch,notable_quotes,"With every company, there is something to worry about, but the question is, which worries are valid and which are not?"
peter_lynch,notable_quotes,"I can't say enough about the fact that earnings are the key to success in investing in stocks. No matter what happens to the market, the earnings will determine the results."
peter_lynch,notable_quotes,"In 30 years, Johnson & Johnson's earnings are up 70-fold, and the stock is up 70-fold. Bethlehem Steel earns less today than it did 30 years ago, and guess what? The stock sells for less than it did 30 years ago."
peter_lynch,notable_quotes,I always feel better about a company when the managers have a financial stake in it.
peter_lynch,notable_quotes,"The best REITs don't want to just pay dividends. They want to grow--buy more properties, collect more rent, drive their stock prices up."
peter_lynch,notable_quotes,"Buy only what you understand, believe in, and intend to stick with--even when others are chasing the next miracle."
peter_lynch,notable_quotes,"Throughout the 1980s, I made a lot of money in foreign stocks for the Magellan Fund."
peter_lynch,notable_quotes,You don't have to be a patriot to invest in America--merely self- interested.
peter_lynch,notable_quotes,It's in the backyard that investors find their edge.
peter_lynch,notable_quotes,It's hard to find real bargains in today's higher-priced market.
peter_lynch,notable_quotes,"In the long run, what keeps me interested in the banking and thrift business is the likelihood of future takeovers and mergers."
peter_lynch,notable_quotes,There are too many banks and too many chicken restaurants in this country already.
peter_lynch,notable_quotes,"My theory is to stay flexible. When people limit themselves to a certain kind of company, they also limit their opportunities."
peter_lynch,notable_quotes,I've never seen a company with a lot of cash and not much debt go bankrupt.
peter_lynch,notable_quotes,"If you keep a list of stocks you'd like to own and watch them like a vulture, eventually you will get the chance to swoop."
peter_lynch,notable_quotes,Behind each of these companies is a leader or a couple of leaders who had the vision and the gumption to do something different.
peter_lynch,notable_quotes,The opinions expressed in this article are strictly those of Peter Lynch and do not reflect the opinions of Fidelity Investments.
peter_lynch,notable_quotes,"Without small companies flourishing underneath the big companies, the U.S. could easily have 15 percent unemployment instead of the recently reported 5.6 percent."
peter_lynch,notable_quotes,That's what I call a remarkable investment: when a company's per-share earnings in a single year exceed the price you paid for the stock. No wonder the stock is up tenfold since 1987.
peter_lynch,notable_quotes,"So you can buy Fannie Mae at its growth rate, whereas you have to pay twice the growth rate to buy shares in the average company in today's market."
peter_lynch,notable_quotes,"If you put together a portfolio of five to ten of these high achievers, there's a decent chance one of them will turn out to be a 10-, a 20-, or even a 50-bagger, where you can make 10, 20, or 50 times your investment."
peter_lynch,notable_quotes,"One of the oldest sayings on Wall Street is 'Let your winners run, and cut your losers.' It's easy to make a mistake and do the opposite, pulling out the flowers and watering the weeds."
peter_lynch,notable_quotes,Mutual funds are a great idea (I ran one once) for folks who want this sort of assistance at a reasonable price.
peter_lynch,notable_quotes,I wish I'd noticed myself. The stock has been a 35-bagger.
peter_lynch,notable_quotes,...but don't take my word for it. Do your homework.
peter_lynch,notable_quotes,"Peter Lynch retired in 1990 from managing the Magellan Fund, the best-performing of all mutual funds over a 15-year period."
peter_lynch,notable_quotes,"Her own experience with Starbucks convinced her the company had two great advantages: It made a product that people wanted, and it sold it at a profit."
peter_lynch,notable_quotes,The very existence of doubt creates the conditions for a big gain in the stock once the fears are put to rest.
peter_lynch,notable_quotes,"A giveaway plan ought to be part of any investment strategy, for what's the use of struggling to accumulate net worth, and then allowing it to be carted off to Washington by strangers?"
peter_lynch,notable_quotes,"If Fidelity Investments had launched its Charitable Gift Fund a few years earlier, my wife and I could have avoided the bother."
