investor,section,content
peter_lynch,investment_philosophy,Peter Lynch managed the Fidelity Magellan fund from 1977 to 1990 and serves as a vice-chairman of Fidelity Management and Research.
peter_lynch,investment_philosophy,"The core principle of stock investing is that you are buying a share of the company's earnings, a concept best visualized by comparing the stock's price line to its earnings line over time."
peter_lynch,investment_philosophy,"A key philosophy is the willingness to buy almost any company at the right price, shifting between categories like growth stocks and cyclicals based on which group is currently undervalued."
peter_lynch,investment_philosophy,Use the relationship between a company's stock price (P) and its earnings (E) to determine if a stock is expensive or cheap.
peter_lynch,investment_philosophy,"Focus on a company's earnings trajectory to understand its fundamental health, rather than just looking at the stock price movement."
peter_lynch,investment_philosophy,The story of a stock can be understood by charting its price line against its earnings line over time.
peter_lynch,investment_philosophy,"Stay invested in stocks for the long haul, as attempting to time the market by avoiding corrections is a losing strategy that significantly reduces returns."
peter_lynch,investment_philosophy,"Only invest money in stocks that you will not need for other purposes in the foreseeable future, with a reasonable investment horizon being twenty years."
peter_lynch,investment_philosophy,"Favor growth companies, which are defined as steady performers that can prosper in all economic conditions, as opposed to cyclicals."
peter_lynch,investment_philosophy,"The primary focus for an investor should be on the company's ""story"" and whether it remains valid, rather than short-term stock price fluctuations. A stock can fall significantly and still be a great long-term investment if the underlying business story is intact."
peter_lynch,investment_philosophy,Significant long-term wealth is created by investing in companies with sustainable high growth rates. A company growing earnings at 20% annually can become an eight-bagger in 14 years.
peter_lynch,investment_philosophy,"Analyzing the long-term relationship between a company's stock price (P) and its earnings (E) is crucial. This ""story"" reveals the company's actual performance versus Wall Street's expectations and helps identify if a stock is cheap or expensive."
peter_lynch,investment_philosophy,"I use charts that plot a company's stock price against its earnings line to find value among growth companies, not to perform technical analysis or predict short-term market movements."
peter_lynch,investment_philosophy,"If a company can maintain its earnings growth, investors will be rewarded in the long run, regardless of short-term market sentiment or valuation."
peter_lynch,investment_philosophy,"Stocks are preferable to bonds for long-term growth, as they have historically provided far superior returns over inflation."
peter_lynch,investment_philosophy,"To succeed in stocks, one must have a long-term time horizon and the conviction to hold, or even add to positions, during market corrections."
peter_lynch,investment_philosophy,"The investment approach should adapt to the company type; fast-growers should reinvest earnings for expansion, while for slow-growers, a rising dividend is a key attraction."
peter_lynch,investment_philosophy,"The foundation of investing is understanding the company's 'story,' which is a simple, real-world narrative explaining the business and its prospects."
peter_lynch,investment_philosophy,"Before committing money to any stock, an investor must be able to articulate a story for it, as this represents the minimum required level of understanding."
peter_lynch,investment_philosophy,"A key to the Magellan fund's success was loading up on cyclical stocks during economic slumps, such as the one in 1981-1982."
peter_lynch,investment_philosophy,"Market leadership is not permanent; what waxes today may wane tomorrow, creating opportunities in out-of-favor sectors like cyclicals after a period of growth stock dominance."
peter_lynch,investment_philosophy,"Keep your focus on the company's fundamental story and progress, not the daily fluctuations of the stock price."
peter_lynch,investment_philosophy,"Trust your own on-the-ground research over the opinions of Wall Street analysts, especially when their negative views contradict strong company fundamentals."
peter_lynch,investment_philosophy,"When a company's growth story is powerful and intact, minor issues like accounting debates can often be insignificant to the long-term investment case."
peter_lynch,investment_philosophy,"An investment story is dynamic and requires continuous monitoring, as events like mergers can complicate the situation considerably."
peter_lynch,investment_philosophy,It is crucial to research a company to distinguish between valid worries that will impact earnings and invalid worries that create buying opportunities.
peter_lynch,investment_philosophy,"One should be willing to buy almost any type of company, whether growth or cyclical, as long as it is available at an attractive price."
peter_lynch,investment_philosophy,"For a long-term portfolio, it is preferable to own consistent growth companies that regularly increase earnings and dividends over cyclical companies with unstable earnings."
peter_lynch,investment_philosophy,"The best companies, such as top REITs, prioritize growth over simply paying dividends, aiming to buy more assets, collect more income, and drive their stock prices up."
peter_lynch,investment_philosophy,"Buy only what you understand, believe in, and intend to stick with, even when others are chasing the next miracle."
peter_lynch,investment_philosophy,"It is better to take an educated risk on a familiar company in your ""backyard"" than to invest blindly in a foreign market you don't understand."
peter_lynch,investment_philosophy,"The primary reason to prefer U.S. stocks is self-interest, as the American system provides a level playing field and superior reporting that protects shareholders."
peter_lynch,investment_philosophy,"Investing abroad can be successful, but only if you are familiar with the territory and can conduct your own thorough research."
peter_lynch,investment_philosophy,Look for companies with a defensible 'lock' on their market or a dominant global franchise.
peter_lynch,investment_philosophy,"Peter Lynch's investment approach includes focusing on industries ripe for consolidation, such as the U.S. banking and thrift sector, which he viewed as having too many separate institutions."
peter_lynch,investment_philosophy,"He believes that mergers and takeovers create value by allowing acquiring companies to cut costs and increase productivity, making the entire industry more efficient."
peter_lynch,investment_philosophy,"A patient, opportunistic approach is key; if an industry becomes too expensive, it's wise to wait for a potential sell-off to create new buying opportunities."
peter_lynch,investment_philosophy,"Peter Lynch is the vice-chairman of Fidelity Management and Research, and co-authored two books on investing."
peter_lynch,investment_philosophy,"Stay flexible in your investment approach, as there are attractive companies of all types, including cyclicals, fast growers, and slow growers; limiting yourself to one kind of company also limits your opportunities."
peter_lynch,investment_philosophy,"The primary focus for an investor should be on whether the company's fundamental story is still valid, especially after a significant drop in the stock price."
peter_lynch,investment_philosophy,"Mature, slower-growing companies can still be decent long-term performers if they are purchased at an undervalued price relative to the overall market."
peter_lynch,investment_philosophy,"Focus on small, dynamic companies as they are the primary engine of economic growth and job creation, offering the potential to grow into industry giants."
peter_lynch,investment_philosophy,Amateur investors can beat market professionals by using their personal knowledge edge and investing in companies they understand.
peter_lynch,investment_philosophy,The long-term success of a stock is fundamentally dependent on the company's underlying earnings growth.
peter_lynch,investment_philosophy,"As vice-chairman of Fidelity Management and Research, Lynch's experience was shaped by his time at a major investment firm, including his famous tenure managing the Magellan Fund."
peter_lynch,investment_philosophy,Individual investors have an advantage over fund managers because they can hold a more concentrated portfolio of just a few well-researched companies.
peter_lynch,investment_philosophy,"Individual investors can gain an edge by discovering successful growth companies in their daily lives, like a local restaurant chain expanding nationally, before Wall Street professionals catch on."
peter_lynch,investment_philosophy,"Use your 'consumer's edge' by investing in companies you understand from personal experience, such as a coffee lover buying Starbucks or a PC owner buying Microsoft."
peter_lynch,investment_philosophy,"It's better to think like an amateur, finding clues in everyday products and experiences, than to try and outsmart the professionals by predicting market turns."
peter_lynch,investment_philosophy,"The existence of doubt about a company creates the conditions for a big gain once fears are put to rest, which an investor can achieve through diligent research before the competition."
peter_lynch,investment_philosophy,A plan for charitable giving and wealth transfer should be an integral part of any investment strategy to avoid having accumulated wealth significantly reduced by taxes.
peter_lynch,invariable_truths,"A quality growth company's 'footprint' is a steady, straight line of earnings growth on a long-term chart, with only occasional bobbles."
peter_lynch,invariable_truths,A stock's price is fundamentally tied to its earnings; a visual history of the price-to-earnings (P/E) ratio can be seen by comparing the stock price line to the earnings line on a chart.
peter_lynch,invariable_truths,"Unlike quality growth companies that sell necessities, cyclical companies that sell big-ticket items will have earnings that wander all over the place, making them streaky and less predictable."
peter_lynch,invariable_truths,"Overpriced growth stocks are doubly risky because the stock can fall even if earnings continue to rise, and it will fall precipitously if earnings decline."
peter_lynch,invariable_truths,"When a stock's price gets too far ahead of its earnings, it can tread water for years even as the company's earnings grow impressively."
peter_lynch,invariable_truths,"In the long run, it doesn't matter much whether your market timing is good or bad; what matters is that you stay invested in stocks to capture the market's key profitable periods."
peter_lynch,invariable_truths,"There has never been a market timer on the list of the world's richest people, which suggests that consistently predicting corrections is impossible."
peter_lynch,invariable_truths,"Over the long term, growth stocks have historically given their owners fewer heartaches and far greater returns than cyclical stocks."
peter_lynch,invariable_truths,"A company's earnings (E) represent the reality of its performance, while the stock price (P) is led by Wall Street expectations and can deviate from reality in the short term."
peter_lynch,invariable_truths,"Consistent high earnings growth compounds powerfully over time. A company that can grow earnings at 20% a year will double them every 3.5 years, which is the mechanism for making big money in stocks."
peter_lynch,invariable_truths,"Over time, a stock's price (P) will gravitate towards its earnings (E), meaning a large gap where price significantly outpaces earnings is not sustainable."
peter_lynch,invariable_truths,"A stock can become a tenbagger on the back of spectacular earnings growth alone, even if the market consistently undervalues it due to perceived risks, as was the case with Philip Morris."
peter_lynch,invariable_truths,An investment that grows tax-free will produce a significantly larger result over time compared to a taxed investment due to the power of tax-free compounding.
peter_lynch,invariable_truths,"Over the long term, stock prices follow the trajectory of corporate earnings."
peter_lynch,invariable_truths,Seemingly 'safe' investments like T-bills or money-market funds can result in a loss of purchasing power once taxes and inflation are factored in.
peter_lynch,invariable_truths,"A company cannot be a good long-term investment, even if it pays a dividend, if the underlying earnings are not growing to support it."
peter_lynch,invariable_truths,"On Wall Street, what waxes today may wane tomorrow, meaning that dominant growth stocks can falter while beaten-down cyclicals are due for a rebound."
peter_lynch,invariable_truths,"Although every recession is different and brings out doomsayers, the modern economy has stabilizing factors like government employment and social safety nets that prevent it from slowing to a complete halt."
peter_lynch,invariable_truths,It is a tremendous advantage for investors to have stores owned by immature public companies open in their neighborhoods. They get an early whiff of success or failure before Wall Street picks up the trail.
peter_lynch,invariable_truths,"Earnings are the key to success in investing in stocks; no matter what happens to the market, the earnings will ultimately determine the results."
peter_lynch,invariable_truths,"Over the long term, a company's stock price will follow the trajectory of its earnings. For example, Johnson & Johnson's earnings and stock both went up 70-fold in 30 years, while Bethlehem Steel's earnings and stock both declined."
peter_lynch,invariable_truths,"Leverage is a basic fact of real-estate investing, as is cyclicity, and the combination of these two factors means volatility is also a given."
peter_lynch,invariable_truths,"The most profitable part of a business may not be its most obvious product; for instance, the real money was in film, not cameras."
peter_lynch,invariable_truths,An investor's advantage is often found in their local knowledge and proximity to companies they can easily understand and research.
peter_lynch,invariable_truths,"The popularity of an investment theme, such as global investing, can cause prices to rise and bargains to disappear."
peter_lynch,invariable_truths,"Industries with significant fragmentation and excess capacity, like the U.S. banking sector with its thousands of separate institutions, are bound to see consolidation over time."
peter_lynch,invariable_truths,A company with a lot of cash and not much debt is highly unlikely to go bankrupt.
peter_lynch,invariable_truths,"A stock can fall by half and still rebound, allowing an investor to make several times their money if the underlying story remains intact."
peter_lynch,invariable_truths,Small companies are the source of economic dynamism and job growth; a small group of them can add over a million jobs while large companies are downsizing.
peter_lynch,invariable_truths,"Over time, a portfolio of small, successful companies can dramatically outperform large, established firms in both sales and earnings growth."
peter_lynch,invariable_truths,Stocks cannot prosper in the long run if the company's earnings are not there to support the price.
peter_lynch,invariable_truths,A truly remarkable investment occurs when a company's per-share earnings in a single year grow to exceed the price you originally paid for the stock.
peter_lynch,invariable_truths,Successful public companies often establish themselves in many regions before the news of their success reaches the major institutional trading desks.
peter_lynch,invariable_truths,"No matter how good a story sounds, you must always do your own homework on a company before investing."
peter_lynch,buy_criteria,"Buy a quality growth stock when its price has fallen while its earnings have continued to rise, causing the gap between the price line and the earnings line to close."
peter_lynch,buy_criteria,"Favor quality-growth companies that sell small-ticket items or necessities, like pharmaceuticals or consumer staples, because their earnings are consistent regardless of the economy's condition."
peter_lynch,buy_criteria,Consider buying quality growth stocks in the spring or early summer to get potential bargains before the 'Second-Half Effect' when institutional investors tend to bid up their prices.
peter_lynch,buy_criteria,The best time to buy a growth stock is when its price line (P) converges with or drops below its earnings line (E).
peter_lynch,buy_criteria,"An attractive opportunity is when a company's P/E ratio equals its growth rate, which is visually represented by the price and earnings lines meeting on a chart."
peter_lynch,buy_criteria,"Look for buying opportunities when a great company's stock price takes a rare dip below its steadily rising earnings line, as seen with Johnson & Johnson in 1994."
peter_lynch,buy_criteria,"External shocks or market panics can create excellent buying opportunities in solid companies, such as when GE's stock dropped before Desert Storm."
peter_lynch,buy_criteria,Market corrections should be viewed as an opportunity to pick up bargains and buy great companies at fire-sale prices.
peter_lynch,buy_criteria,Look for companies with a strong balance sheet and no debt to minimize bankruptcy risk.
peter_lynch,buy_criteria,"Identify fast-growing companies, particularly those expanding globally into new markets, as they offer the potential for excellent growth for a decade or more."
peter_lynch,buy_criteria,Use price-to-earnings (P/E) charts to find growth companies where the stock price is cheap relative to its historical earnings trend.
peter_lynch,buy_criteria,A great buying opportunity in a growth company occurs when its stock price (P) converges with or temporarily dips below its earnings line (E).
peter_lynch,buy_criteria,"External events or market panics can create excellent buying opportunities in solid companies, such as when GE's price dropped before Desert Storm."
peter_lynch,buy_criteria,"Consider buying a formerly fast-growing company after its stock has fallen and its valuation has become more reasonable, especially if there's a chance it can regain some of its earnings momentum."
peter_lynch,buy_criteria,"For slow-growing companies, look for those that consistently raise their dividend payout, as this has been a mark of excellent long-term investments, provided earnings support the increases."
peter_lynch,buy_criteria,"Favor companies in cyclical industries that have developed a business model to protect themselves from the industry's inherent risks, such as interest rate fluctuations."
peter_lynch,buy_criteria,"Prioritize companies with 'earnings visibility,' which means there is a high degree of confidence that the company will meet its future earnings estimates."
peter_lynch,buy_criteria,"Look for companies with steady, predictable earnings growth, a quality not typically found in cyclical stocks like airlines or automakers."
peter_lynch,buy_criteria,"A good opportunity exists when a company's stock is selling below its expected earnings growth rate, as the market is failing to account for its real future growth."
peter_lynch,buy_criteria,Focus on companies whose business stories are simple enough for any intelligent person to understand.
peter_lynch,buy_criteria,"The best time to get involved with cyclicals is when the economy is at its weakest, earnings are at their lowest, and public sentiment is at its bleakest."
peter_lynch,buy_criteria,"To distinguish a growth stock from a cyclical, look at its earnings line on a chart; a steady upward slope indicates a growth stock, while a line that wobbles up and down suggests a cyclical."
peter_lynch,buy_criteria,"Identify a simple, powerful growth story, such as millions of VCR owners needing an endless supply of tapes."
peter_lynch,buy_criteria,"Confirm the story with on-the-ground research, such as visiting stores to see how crowded they are and counting cars in the parking lot."
peter_lynch,buy_criteria,"Look for confirmation in company filings and revenue figures, such as revenues more than doubling in the first three months of a new store's operation."
peter_lynch,buy_criteria,"The involvement of proven, successful management, like Wayne Huizenga's role at Blockbuster after his success at Waste Management, is a very positive sign."
peter_lynch,buy_criteria,Heavy volume in an upward-moving stock can be a harbinger of more big moves to come.
peter_lynch,buy_criteria,"Look for opportunities in quality growth stocks where the stock price has fallen while earnings have continued to rise, closing the gap between price and fundamental value."
peter_lynch,buy_criteria,"Recognize that different sectors, like growth stocks and cyclicals, can be alternately cheap or overpriced, and adjust your focus accordingly."
peter_lynch,buy_criteria,"Look for companies where managers have a significant financial stake in the business; for a REIT, management should own a minimum of 10 percent of the shares."
peter_lynch,buy_criteria,"Examine the rate of growth for net income and Funds From Operation (FFO), as the top companies show steady, sustainable growth."
peter_lynch,buy_criteria,"When evaluating REITs, use the price-to-FFO ratio as a reasonable measure of valuation and comparison, as the standard P/E ratio is not useful."
peter_lynch,buy_criteria,"The best REITs look for ways to use their cash for growth, so a lower dividend yield can be a positive sign of a company reinvesting for the future."
peter_lynch,buy_criteria,"Look for companies with a 'lock' on their market or global domination in their trade, such as Gillette's hold on the razor business."
peter_lynch,buy_criteria,"Invest in promising small growth companies, particularly those with strong, exportable brands and cultural appeal like McDonald's or Toys 'R' Us."
peter_lynch,buy_criteria,Seek out bargains in under-covered markets where companies may be selling for a fraction of their actual worth due to sketchy reporting and a lack of analyst coverage.
peter_lynch,buy_criteria,"Look for bargains in the thrift sector by identifying companies with low price-to-earnings (P/E) ratios, ideally 10 or below."
peter_lynch,buy_criteria,A key indicator of a bargain is when a thrift is trading below its book value.
peter_lynch,buy_criteria,"The potential for a takeover is a primary reason for investing, as acquisitions often happen at a significant premium to book value, creating a 'secondary pop' in the stock price."
peter_lynch,buy_criteria,"Favorable short-term catalysts, such as regulatory changes that lower insurance premiums and boost earnings, make a thrift more attractive."
peter_lynch,buy_criteria,"Look for companies with no debt, low price-to-earnings (P/E) ratios, good records, and prospects in businesses that are easy to understand."
peter_lynch,buy_criteria,"Seek out companies that are undervalued relative to the market, such as a stock trading at 10 times earnings when the market average is 15."
peter_lynch,buy_criteria,"When screening beaten-down stocks, look for companies whose current assets are at least two times greater than all their debt."
peter_lynch,buy_criteria,A key goal is to find situations where there is little or no debt and the cash per share is nearly equal to or greater than the stock's price.
peter_lynch,buy_criteria,Look for the chance to buy more shares of a company you know well when its price drops for reasons that have nothing to do with the business fundamentals.
peter_lynch,buy_criteria,"Evaluate a beaten-down stock for the probability of a turnaround, where the price decline is a temporary aberration and a re-acceleration of growth is possible."
peter_lynch,buy_criteria,A company with both a good growth rate and a high dividend is a rare and attractive opportunity.
peter_lynch,buy_criteria,"Invest in companies led by visionary leaders with the 'vision and the gumption to do something different,' such as creating a new business model or challenging an established monopoly."
peter_lynch,buy_criteria,"Look for companies that embrace new technology to gain a competitive advantage and thrive, even in struggling industries, like Nucor did with thin-slab casting."
peter_lynch,buy_criteria,"Look for companies where the stock is relatively cheap compared to its growth, such as when the P/E ratio is at or below the annual earnings growth rate."
peter_lynch,buy_criteria,"Invest in industry-leading companies that have a durable competitive advantage, such as Fannie Mae's ability to protect itself from interest rate changes."
peter_lynch,buy_criteria,"Favor companies that have a consistent track record of record earnings, particularly with double-digit annual growth."
peter_lynch,buy_criteria,"Before investing, wait for evidence that a company's successful business model is repeatable and expanding into new markets."
peter_lynch,buy_criteria,Only invest in companies you understand that possess a superior product or franchise with clear opportunities for future growth.
peter_lynch,buy_criteria,"A company must have a good 'story,' which includes a product people want, the ability to sell it at a profit, and a well-conceived plan for expansion."
peter_lynch,buy_criteria,"Look for companies with a strong balance sheet, steady earnings growth, and a large potential market for their products or services."
peter_lynch,buy_criteria,"Seek out businesses with a powerful competitive advantage, such as a virtual monopoly on an essential product like Microsoft had with its MS/DOS operating system."
