investor,section,content
peter_lynch,avoid_red_flags,"Avoid expensive growth stocks where the price line on a chart has strayed far above the earnings line, as this indicates the stock is overpriced and investors are paying an unusually high P/E ratio."
peter_lynch,avoid_red_flags,"Be wary of adding to a portfolio when a group of stocks, like the quality-growth list in 1991, becomes overextended and widely popular, as they are likely overpriced."
peter_lynch,avoid_red_flags,"Avoid buying stocks when there is a wide gap between the price line (P) and the earnings line (E), as this indicates an unfavorable risk/reward ratio."
peter_lynch,avoid_red_flags,"Be wary of paying a large premium for a stock based on faith in its future growth, as seen with Wal-Mart in 1992, which led to three years of stock stagnation despite a 50% rise in earnings."
peter_lynch,avoid_red_flags,"Avoid stocks with extremely high P/E ratios, such as companies selling for 70-80 times earnings, as it can take a decade for the fundamentals to justify such a high price."
peter_lynch,avoid_red_flags,"Avoid companies that are saddled with debt, as this introduces a significant risk of bankruptcy."
peter_lynch,avoid_red_flags,"Do not overpay for growth stocks, as this creates a highly unfavorable risk/reward ratio. An overpriced stock is doubly risky because it can fall even if the company's earnings continue to rise."
peter_lynch,avoid_red_flags,"Be cautious of a stock where the price (P) has raced far ahead of the earnings (E), creating a 'dangerous gap' that indicates it may be overpriced."
peter_lynch,avoid_red_flags,Buying a stock 'on strength' is a lousy strategy when it means purchasing a company whose price has significantly outdistanced its fundamental earnings power.
peter_lynch,avoid_red_flags,A slowdown in earnings momentum for a high-growth company is a major signal that requires a re-evaluation of the investment story and its valuation.
peter_lynch,avoid_red_flags,"Avoid stocks that appear cheap but have questionable fundamentals, a common trap in volatile sectors."
peter_lynch,avoid_red_flags,"Be cautious when a stock's price is based on unrealistic growth expectations, such as when its P/E ratio is roughly double its expected earnings growth rate."
peter_lynch,avoid_red_flags,"Avoid buying stocks without understanding their fundamental nature, as investors who failed to recognize waste-management companies as cyclical bought at the wrong time and were clobbered in the recession."
peter_lynch,avoid_red_flags,"Avoid investing in companies, even solid growth companies, when they are engaged in price wars, as these are detrimental to earnings."
peter_lynch,avoid_red_flags,"Be wary of a stock that is cheap for a good reason, which often means the company has genuine troubles that justify the low price."
peter_lynch,avoid_red_flags,"For REITs, the price-to-earnings (P/E) ratio is not a useful metric for comparison because different companies calculate earnings differently."
peter_lynch,avoid_red_flags,"Be wary of a stock issuance that is used to support faltering operations or prop up the dividend, as this is the worst kind."
peter_lynch,avoid_red_flags,"If you see a dividend yield above 8 percent for a REIT, do more research, as it may signal a company that doesn't have a viable growth strategy."
peter_lynch,avoid_red_flags,Avoid REITs with excessive debt; conservative analysts dislike seeing debt that totals more than 40 percent of a REIT's estimated asset value.
peter_lynch,avoid_red_flags,"Avoid small-company growth stocks, even in a promising market, if they are so overpriced that there is little chance for an investor to gain on the upside."
peter_lynch,avoid_red_flags,Be cautious about investing in markets with primitive reporting systems and weak regulatory authorities that don't adequately protect investors.
peter_lynch,avoid_red_flags,"Be cautious in a higher-priced market where it is difficult to find bargains, such as when target companies trade at P/E ratios above 10 and prices above book value."
peter_lynch,avoid_red_flags,A slowdown in takeover activity can be a warning sign that assets in the sector are becoming too expensive for acquirers.
peter_lynch,avoid_red_flags,"When screening for potential investments, reject companies that have a low cash position or a declining sales trend."
peter_lynch,avoid_red_flags,"Avoid large, paternalistic companies that have stagnated by resisting innovation and necessary cost-cutting, as they are unlikely to produce significant growth."
peter_lynch,avoid_red_flags,Do not buy stocks based on tips alone without conducting your own thorough research.
peter_lynch,avoid_red_flags,"Avoid buying stocks in companies you know little about, particularly those with questionable prospects or weak balance sheets."
peter_lynch,avoid_red_flags,Failing to follow a company's story after you've invested is a major red flag; you must stay informed to know when things get worse.
peter_lynch,avoid_red_flags,"Avoid investing directly in treacherous industries with excessive competition where companies are constantly undercutting each other, such as computer manufacturing."
peter_lynch,position_sizing_portfolio,"Stay fully invested in stocks and avoid owning long-term bonds, as they can be nearly as volatile as stocks during interest rate changes but lack the same upside potential."
peter_lynch,position_sizing_portfolio,It can be a prudent move to sell a portion of a winning stock if you become worried about the overall market or having too much money concentrated in a single issue.
peter_lynch,position_sizing_portfolio,An individual investor can achieve superior returns by building a concentrated portfolio of five to ten high-achieving companies.
peter_lynch,position_sizing_portfolio,"A portfolio of a handful of stocks increases the odds that one will become a tenbagger or more, which is all it takes to produce a lifetime of superior returns."
peter_lynch,position_sizing_portfolio,The outsized gain from one big winner in a portfolio can be so large that it makes up for several other stocks that perform poorly.
peter_lynch,sell_discipline,"A stock may no longer be a bargain and could be considered for selling when its price line drifts significantly far away from its earnings line, indicating it has become expensive relative to its profits."
peter_lynch,sell_discipline,"Take a tip from Warren Buffett and get out of stocks that are selling for extremely high valuations, such as 83 times earnings."
peter_lynch,sell_discipline,"The decision to hold or sell a stock that has fallen in price should be based on whether the fundamental ""story"" of the company is still valid, not on the price action alone."
peter_lynch,sell_discipline,"One should not use P/E charts as a signal to sell good growth companies every time they appear overpriced, as this turns a long-term investor into a market timer."
peter_lynch,sell_discipline,"If you would be inclined to sell a stock if its price dropped, you should probably sell it now, as you lack the conviction needed to hold it through inevitable market downturns."
peter_lynch,sell_discipline,"Avoid the temptation to sell a great company just because you have a large profit. If the fundamental story remains strong, you should hold on to capture further gains."
peter_lynch,sell_discipline,"Selling a portion of a massive winner for risk management may seem smart short-term, but it can cause you to miss out on the majority of a stock's long-term, tenfold gain."
peter_lynch,sell_discipline,"The investment thesis for a thrift often culminates in its acquisition by a larger institution, realizing gains when the stock price receives a 'secondary pop' to a premium over book value."
peter_lynch,sell_discipline,"Adhere to the principle: 'Let your winners run, and cut your losers.'"
peter_lynch,sell_discipline,Avoid the common mistake of selling your best-performing stocks (the 'flowers') while holding on to your losing investments (the 'weeds').
peter_lynch,risk_management,A primary risk management technique is to consult a chart of a stock's price versus its earnings line before buying and every six months thereafter to avoid overpaying for earnings.
peter_lynch,risk_management,"Manage risk by avoiding overpaying for growth, as a high valuation creates a highly unfavorable risk/reward ratio."
peter_lynch,risk_management,A narrowing gap between a stock's price and its earnings line indicates that the stock is becoming less risky than it was previously.
peter_lynch,risk_management,The biggest risk is not being in the market; missing just the 40 most profitable months over 40 years can cause a stock portfolio to underperform a savings account.
peter_lynch,risk_management,"Realize that you can afford to wait out any correction, which turns a potential calamity into an opportunity to buy."
peter_lynch,risk_management,"Dividends provide a cushion during corrections, ensuring that total returns can still be positive even during long periods of market stagnation."
peter_lynch,risk_management,"A primary method of risk management is to invest in debt-free companies, thereby avoiding bankruptcy risk."
peter_lynch,risk_management,Avoid unfavorable risk/reward situations by not overpaying for growth stocks. Use long-term price and earnings charts to help identify when a growth stock has become too expensive.
peter_lynch,risk_management,"If you have extra money to invest, hold off on buying more of a favorite growth company if its price (P) has far outdistanced its earnings (E) until the valuation becomes more reasonable."
peter_lynch,risk_management,"Investors can manage risk by selecting investment pools that match their tolerance for market fluctuations, such as choosing between a growth pool, an equity-income pool, or an interest-income pool."
peter_lynch,risk_management,"The primary method for managing stock market risk is to maintain a long-term perspective, which allows an investor to ride out inevitable corrections."
peter_lynch,risk_management,"Before buying a stock, an investor should confirm they have the conviction to buy more if the price falls; if not, the position is too risky for them."
peter_lynch,risk_management,"Recognize that bonds and other 'safe' investments carry significant risks, including interest rate risk and the risk that returns won't keep pace with inflation."
peter_lynch,risk_management,"Be extremely cautious in volatile sectors like technology, which can be an 'investing minefield' where a company's health can deteriorate very rapidly."
peter_lynch,risk_management,"To avoid getting sucked into the gloom of a recession when buying cyclicals, remind yourself of the economy's modern stabilizing factors that make a total collapse less likely than in the past."
peter_lynch,risk_management,A key risk is misclassifying a company; investors who failed to see that waste-management was a cyclical business bought at the wrong time and were hurt in the recession.
peter_lynch,risk_management,"To manage risk, an investor might sell a portion of a highly successful position if they feel over-concentrated or are concerned about the broader stock market."
peter_lynch,risk_management,"Differentiate between valid and invalid worries about a company by conducting thorough research into its business segments, revenue sources, and the actual impact of perceived threats."
peter_lynch,risk_management,"Acknowledge that even high-quality growth stocks will suffer price declines during a bear market, although perhaps not as severely as weaker companies."
peter_lynch,risk_management,Be aware that aggressive REITs using leverage can be 'hoisted on that leverage' when the economic cycle moves against them.
peter_lynch,risk_management,"If you believe in an investment idea but lack the time or a research edge, consider letting professionals manage it for you by investing in a mutual fund."
peter_lynch,risk_management,"Prefer investing in markets with a strong regulatory framework like the U.S. SEC, which provides a level playing field and protects investors through accurate and timely reporting."
peter_lynch,risk_management,Recognize that managing a portfolio of foreign stocks is a much harder job than a domestic one because it requires doing your own research to compensate for poor reporting.
peter_lynch,risk_management,"If a sector becomes overvalued, it is prudent to wait for a sell-off, which would create new, more attractive opportunities with a better margin of safety."
peter_lynch,risk_management,"A basic rule is to seek the safest investment value with the smallest downside risk, which is often found by focusing on a company's strong balance sheet."
peter_lynch,risk_management,"Before investing, identify potential risks, such as a future change in a company's tax status, and assess whether the market has already discounted that risk in the stock price."
peter_lynch,risk_management,The power of a single tenbagger can be so great that it offsets the losses from several other poor investments within the same portfolio.
peter_lynch,risk_management,"A primary risk for investors is not following the 'story' of their companies, which can lead to holding a losing stock as its fundamentals deteriorate."
peter_lynch,risk_management,Mitigate investment risk by personally doing the research and checking the facts to put fears about a company to rest before the competition does.
peter_lynch,signature_patterns,"The 'Second-Half Effect' is a seasonal pattern where quality growth stocks tend to appreciate in the third and fourth quarters, creating a potential buying opportunity in the spring and early summer."
peter_lynch,signature_patterns,"A quality growth company can be identified by its 'footprint' on a chart: a steady, straight line of earnings-per-share growth over a long period."
peter_lynch,signature_patterns,"A key analysis method is using a chart of the stock price versus the earnings line as a simple, visual tool to understand the company's P/E ratio history and determine if it's currently expensive."
peter_lynch,signature_patterns,A key analytical pattern is to chart a company's stock price against its earnings line to visually assess valuation and identify opportunities.
peter_lynch,signature_patterns,"A recurring pattern is to buy solid growth companies when the price line (P) dips to meet or cross below the earnings line (E), representing a chance to buy future growth at a bargain price."
peter_lynch,signature_patterns,"Growth companies have historically been star performers during and after market corrections, holding their value better and recovering faster than other categories like cyclicals or large-cap indexes."
peter_lynch,signature_patterns,Lynch uses long-term (10-year and 35-year) charts plotting a company's stock price (P) against its earnings (E) to understand its story and valuation.
peter_lynch,signature_patterns,A classic growth company is identifiable on a chart by an earnings line (E) that maintains a steady upward course year after year.
peter_lynch,signature_patterns,"An opportunity may exist when the price line (P) of a solid growth company zigs down, making the stock cheap relative to its consistently growing earnings line (E)."
peter_lynch,signature_patterns,"A signature analysis method involves charting a stock's price (P) against its earnings line (E) to visually identify different company types, such as fast growers, slow growers, and cyclicals."
peter_lynch,signature_patterns,"A chronically underpriced growth stock, whose price consistently lags its earnings due to market fears, can still be a massive winner if earnings growth is strong enough to drive the stock up tenfold in ten years."
peter_lynch,signature_patterns,"Lynch utilizes 'challenge grants' in his philanthropy, offering a donation on the condition that the recipient organization raises a matching amount from other sources to leverage his contribution."
peter_lynch,signature_patterns,"As a trustee for the Fidelity Group of Funds, Lynch would use his public platform to promote specific Fidelity products he found valuable, such as the Charitable Gift Fund."
peter_lynch,signature_patterns,"Analyze a stock's story by considering how different market participants (growth, value, momentum investors) view it, in order to find opportunities where the company is misunderstood or out of favor."
peter_lynch,signature_patterns,"When a company's growth slows, re-evaluate it based on its new reality rather than automatically selling; a lower P/E can make it attractive even with slower growth."
peter_lynch,signature_patterns,"Significant opportunities can be found in overlooked companies, such as those that are not part of major indexes like the S&P 500."
peter_lynch,signature_patterns,"A 'special situation' can create a good short-term investment story, involving an event that brings a company back from a down period or adds a near-term buzz to earnings growth."
peter_lynch,signature_patterns,"A signature strategy for the Magellan fund was to heavily invest in cyclical companies during economic recessions, anticipating their strong rebound during the recovery."
peter_lynch,signature_patterns,"A simple way to identify a cyclical company is to check its earnings chart; a wobbly line that goes up and down, as opposed to the steady upward slope of a growth stock, is the signature of a cyclical."
peter_lynch,signature_patterns,"A powerful growth story can be confirmed by simple, direct observation, like seeing that a company's stores are always packed with customers."
peter_lynch,signature_patterns,"When a company's growth is tremendous, a potential one-time earnings hit from an accounting change can be 'peanuts' compared to the overall positive story."
peter_lynch,signature_patterns,"When a negative analyst report causes a stock to drop, it can be a buying opportunity if your own research confirms the company's fundamentals are still strong."
peter_lynch,signature_patterns,"The 'Second-Half Effect' describes a tendency for analysts to shift focus from the current year's earnings to the next year's earnings as the year progresses, which can make stocks look cheaper and cause their prices to rise."
peter_lynch,signature_patterns,The earnings of cyclical companies are too unstable and unpredictable to analyze with forward-looking valuation methods like the 'Second-Half Effect'.
peter_lynch,signature_patterns,"Top-performing REITs exhibit a pattern of steady, sustainable growth in both net income and Funds From Operation (FFO)."
peter_lynch,signature_patterns,"For the Magellan Fund, a successful strategy involved finding bargains in foreign stocks that were poorly covered by analysts and sold for a fraction of their actual worth."
peter_lynch,signature_patterns,"Lynch favors companies with strong, exportable American culture and brands, such as Mickey Mouse, McDonald's, and soft drinks, seeing them as a source of economic strength."
peter_lynch,signature_patterns,"He finds investment ideas by observing familiar, everyday businesses in his own ""backyard,"" such as Supercuts or Au Bon Pain."
peter_lynch,signature_patterns,"A typical thrift stock investment advances in three distinct phases: an initial pop after going public, a gradual rise toward its book value, and a final, secondary pop when it is acquired at a premium."
peter_lynch,signature_patterns,"Maintain a list of stocks you'd like to own and watch them like a vulture, waiting for the chance to buy when the price drops for non-fundamental reasons."
peter_lynch,signature_patterns,"Look for buying opportunities in good companies after a significant market decline or at year's end, when tax-loss selling creates pressure on stock prices."
peter_lynch,signature_patterns,Find an edge by investing in under-followed companies that Wall Street ignores but that amateur investors can know firsthand.
peter_lynch,signature_patterns,"Use personal experience with a company's products or services, like visiting its amusement parks, as a form of on-site research to understand the business."
peter_lynch,signature_patterns,Understand a company's seasonal business patterns to recognize that a price drop during an off-season is not necessarily related to poor results.
peter_lynch,signature_patterns,A good starting point for finding turnarounds is to screen for stocks that have fallen 50 percent or more from their 12-month highs and then investigate their fundamentals.
peter_lynch,signature_patterns,"Identify small or medium-sized companies with the potential for massive growth, such as how Wal-Mart grew from a small company in 1985 to be larger than most established giants."
peter_lynch,signature_patterns,"Look for companies with a compelling growth story, often involving a founder who turned a simple idea or a business plan into a multi-billion dollar enterprise, like Staples or Federal Express."
peter_lynch,signature_patterns,A key characteristic of a tenbagger is when a company's annual per-share earnings eventually grow to surpass the original purchase price of the stock.
peter_lynch,signature_patterns,"Lynch seeks opportunities where the market misunderstands a company's risks, causing its stock to be undervalued, as was the case with persistent worries about Fannie Mae."
peter_lynch,signature_patterns,Continuously checking the 'story' is essential to determine if a company's fundamentals are improving or if it's time to sell.
peter_lynch,signature_patterns,"A key pattern is the 'local favorite expands nationally' story, where a company like Starbucks or Au Bon Pain has a proven concept and a long runway for growth into new markets."
peter_lynch,signature_patterns,"Invest in a key supplier with a 'virtual monopoly' that profits from an entire industry's growth, such as Microsoft providing the operating system for the competitive PC market."
peter_lynch,blind_spots_mistakes,"A common mistake is to look only at stock prices; if a price is flat but earnings are rising, the company is likely doing fine and the stock is becoming a better value."
peter_lynch,blind_spots_mistakes,"Paying a significant premium for a great company is a mistake, as the stock can go nowhere for years while the valuation catches up to the price, even if earnings grow."
peter_lynch,blind_spots_mistakes,"Investors often make the mistake of ignoring special investment opportunities they are offered, such as the chance to research and buy shares in a local S&L that is going public."
peter_lynch,blind_spots_mistakes,"Lynch noted that he incurred significant legal fees and paperwork by establishing a private foundation, a bother that could have been avoided by using a more efficient vehicle like a charitable gift fund."
peter_lynch,blind_spots_mistakes,"A common mistake investors made was not recognizing that some industries, like waste-management, were cyclical, causing them to buy at the top of the cycle only to be hurt in the subsequent recession."
peter_lynch,blind_spots_mistakes,"Selling a portion of a big winner to manage risk, while seemingly prudent, can be a mistake in the long run if it prevents you from realizing the full potential of a tenbagger."
peter_lynch,blind_spots_mistakes,"Don't get too hung up on a high dividend yield, as it may attract investors but can signal that a company lacks a viable strategy for growth."
peter_lynch,blind_spots_mistakes,A common mistake with REITs is to use the P/E ratio for valuation; the price-to-FFO ratio is a more meaningful measure for comparison in this industry.
peter_lynch,blind_spots_mistakes,"A common mistake is 'pulling out the flowers and watering the weeds,' which means selling winning stocks too early while holding on to losers indefinitely."
peter_lynch,blind_spots_mistakes,"Many investors fail by trading too frequently, buying companies they don't understand, and failing to check the story after they buy."
peter_lynch,blind_spots_mistakes,Sticking with losing stocks 'through thin and thinner' without re-evaluating the company's fundamental story is a recipe for failure.
peter_lynch,blind_spots_mistakes,"Lynch regrets missing the investment in Microsoft, a 35-bagger, because he failed to apply his own 'think like an amateur' principle and notice the software inside every PC."
peter_lynch,notable_quotes,"On such a chart, the price line and the earnings line, taken together, serve as an important reminder of what we're buying when we buy a stock: a share of the earnings."
peter_lynch,notable_quotes,"When the price line strays far above the earnings line... it means the stock is very expensive, and people are paying an unusually high price for owning Johnson & Johnson."
peter_lynch,notable_quotes,"I'll buy almost any company at some price, and whereas two years ago the growth group was overpriced and the cyclicals were cheap, now it's the reverse."
peter_lynch,notable_quotes,"Overpriced growth stocks are doubly risky: If the earnings take a dive, the stock price heads for the bottom, and even if the earnings go up, the stock price may take a dive, or at best treadwater."
peter_lynch,notable_quotes,"When you way overpay for growth, the risk/reward ratio is highly unfavorable."
peter_lynch,notable_quotes,"The best time to buy the stock is when the P comes back to the E, or drops below the E..."
peter_lynch,notable_quotes,"When the two lines converge, it means the company's growth rate is equal to its p/e ratioŠa good opportunity to invest in future growth at a bargain price."
peter_lynch,notable_quotes,"If you were out of stocks for 40 key months in 40 years, trying to avoid corrections, your stock portfolio underperformed your savings account."
peter_lynch,notable_quotes,In the long run it doesn't matter much whether your timing is good or bad. What matters is that you stay invested in stocks.
